Music;Artist;Text;Language;Url;Search Status;
NuvemPassageira;HermesAquino;Eu sou nuvem passageira Que com o vento se vai Eu sou como um cristal bonito Que se quebra quando cai  Não adianta escrever meu nome numa pedra Pois esta pedra em pó vai se transformar Você não vê que a vida corre contra o tempo Sou um castelo de areia na beira do mar  Eu sou nuvem passageira Que com o vento se vai Eu sou como um cristal bonito Que se quebra quando cai  A lua cheia convida para um longo beijo Mas o relógio te cobra o dia de amanhã Estou sozinho, perdido e louco, no meu leito E a namorada analisada por sobre o divã  Eu sou nuvem passageira Que com o vento se vai Eu sou como um cristal bonito Que se quebra quando cai  Por isso agora o que eu quero é dançar na chuva Não quero nem saber de me fazer ou me matar Eu vou deixar em dia a vida e a minha energia Sou um castelo de areia na beira do mar.  Eu sou nuvem passageira Que com o vento se vai Eu sou como um cristal bonito Que se quebra quando cai  Eu sou nuvem passageira Que com o vento se vai Eu sou como um cristal bonito Que se quebra quando cai  Eu sou nuvem passageira Que com o vento se vai Eu sou como um cristal bonito Que se quebra quando cai  Eu sou nuvem passageira Que com o vento se vai Eu sou como um cristal bonito Que se quebra quando cai;PT-BR;https://api.vagalume.com.br/search.php?art= Hermes Aquino &mus=Nuvem-Passageira&apikey=dc668952146a4a25b6d06586e7b69708;aprox
MeninadeCabelosLongos;Agepê;E! E! Ei! Menina de cabelos longos Quero te levar pra longe E no primeiro bonde a gente pode partir..ei menina  Quem sabe indo pro Recife ou então Sergipe A gente compra um jipe lá Ou direto pra Bahia Que eu tenho uma tia lá  Prá só comer, beber, dormir e não pagar Pra comer, beber, dormir Prá comer, beber, dormir  Prá comer, beber, dormir e não pagar  Ei! Ei! Ei! Menina de cabelos longos Quero te levar pra longe E no primeiro bonde a gente pode partir  Eu sei que no Nordeste tem cabra da peste No Norte tem faca de corte e calor Mas vou levar cheio de bala Um trezoitão na mala e um ventilador  Ei! Menina Que vida boa a gente vai levar Melhor que a vida de rainha e rei Melhor que tudo que se imaginar   Prá só comer, beber, dormir e não pagar Pra comer, beber, dormir Prá comer, beber, dormir  Prá comer, beber, dormir e não pagar  Ei! Ei! Ei! Menina de cabelos longos Quero te levar pra longe E no primeiro bonde a gente pode partir..ei menina;PT-BR;https://api.vagalume.com.br/search.php?art= Agepe &mus=Menina-de-Cabelos-Longos&apikey=dc668952146a4a25b6d06586e7b69708;exact
Debaixodoscaracóis;RobertoCarlos;Um dia a areia branca seus pés irão tocar E vai molhar seus cabelos a água azul do mar Janelas e portas vão se abrir pra ver você chegar E ao se sentir em casa, sorrindo vai chorar   Debaixo dos caracóis dos seus cabelos Uma história pra contar de um mundo tão distante Debaixo dos caracóis dos seus cabelos Um soluço e a vontade de ficar mais um instante   As luzes e o colorido Que você vê agora Nas ruas por onde anda,  na casa onde mora Você olha tudo e nada Lhe faz ficar contente Você só deseja agora Voltar pra sua gente   Debaixo dos caracóis dos seus cabelos Uma história pra contar de um mundo tão distante Debaixo dos caracóis dos seus cabelos Um soluço e a vontade de ficar mais um instante  Você anda pela tarde E o seu olhar tristonho Deixa sangrar no peito Uma saudade, um sonho Um dia vou ver você Chegando num sorriso Pisando a areia branca Que é seu paraíso.  Debaixo dos caracóis dos seus cabelos Uma história pra contar de um mundo tão distante Debaixo dos caracóis dos seus cabelos Um soluço e a vontade de ficar mais um instante  Debaixo dos caracóis dos seus cabelos Uma história pra contar de um mundo tão distante Debaixo dos caracóis dos seus cabelos Um soluço e a vontade de ficar mais um instante   Debaixo dos caracóis dos seus cabelos Uma história pra contar de um mundo tão distante Debaixo dos caracóis dos seus cabelos Um soluço e a vontade de ficar mais um instante;PT-BR;https://api.vagalume.com.br/search.php?art= Roberto Carlos &mus=Debaixo-dos-caracois&apikey=dc668952146a4a25b6d06586e7b69708;aprox
MalucoBeleza;RaulSeixas;Enquanto você Se esforça pra ser Um sujeito normal E fazer tudo igual Eu do meu lado Aprendendo a ser louco Um maluco total Na loucura real  Controlando A minha maluquez Misturada Com minha lucidez Vou ficar Ficar com certeza Maluco beleza Eu vou ficar Ficar com certeza Maluco beleza  E esse caminho Que eu mesmo escolhi É tão fácil seguir Por não ter onde ir Controlando A minha maluquez Misturada Com minha lucidez Eeeeeeeeuu! Controlando A minha maluquez Misturada Com minha lucidez  Vou ficar Ficar com certeza Maluco beleza Eu vou ficar Ficar com certeza Maluco beleza Eu vou ficar Ficar com toda certeza Maluco, maluco beleza;PT-BR;https://api.vagalume.com.br/search.php?art= Raul Seixas &mus=Maluco-Beleza&apikey=dc668952146a4a25b6d06586e7b69708;aprox
LoveUnlimitedOrchestra;Love’sTheme;Play our love's theme tonight My love's here, it's no dream tonight It"s been so long Since we've danced to our love song I know the melody that made him mine Will be the melody that keeps him close to me (love's theme) Play our love's theme once more Make him feel, like he felt before While the lights are low Please, let the music flow I know that the melody that made him mine Will be the melody that keeps him close to me (love's theme) Play our love's theme again Touch his heart, touch his soul and then Once we sip the wine His lips will come to mine I know that the melody that made him mine Will be the melody that keeps him close to me Love's theme;PT-BR;https://api.vagalume.com.br/search.php?art= Love’s Theme &mus=Love-Unlimited-Orchestra&apikey=dc668952146a4a25b6d06586e7b69708;GoogleSearch OK
Êbaiana;ClaraNunes;Ê baiana Ê ê ê baiana, baianinha Ê baiana Ê ê ê baiana  Baiana boa Gosta do samba Gosta da roda E diz que é bamba Baiana boa Gosta do samba Gosta da roda E diz que é bamba  Olha Toca a viola Que ela quer sambar Ela gosta do samba Ela quer rebolar Toca a viola Que ela quer sambar Ela gosta do samba Ela quer rebolar  Ê baiana  Ê baiana Ê ê ê baiana, baianinha Ê baiana Ê ê ê baiana;PT-BR;https://api.vagalume.com.br/search.php?art= Clara Nunes &mus=E-baiana&apikey=dc668952146a4a25b6d06586e7b69708;aprox
PavãoMysteriozo;Ednardo;Pavão misterioso Pássaro formoso Tudo é mistério Nesse teu voar Ai se eu corresse assim Tantos céus assim Muita história Eu tinha pra contar Pavão misterioso Pássaro formoso Tudo é mistério Nesse teu voar Ai se eu corresse assim Tantos céus assim Muita história Eu tinha pra contar Pavão misterioso Nessa cauda Aberta em leque Me guarda moleque De eterno brincar Me poupa do vexame De morrer tão moço Muita coisa ainda Quero olhar Pavão misterioso Pássaro formoso Tudo é mistério Nesse teu voar Ai se eu corresse assim Tantos céus assim Muita história Eu tinha pra contar Pavão misterioso Meu pássaro formoso No escuro dessa noite Me ajuda a cantar Derrama essas faíscas Despeja esse trovão Desmancha isso tudo, oh Que não é certo não Pavão misterioso Pássaro formoso Um conde raivoso Não tarda a chegar Não temas, minha donzela Nossa sorte nessa guerra Eles são muitos Mas não podem voar;PT-BR;https://api.vagalume.com.br/search.php?art= Ednardo &mus=Pavao-Mysteriozo&apikey=dc668952146a4a25b6d06586e7b69708;GoogleSearch OK
Sobradinho;Sá,RodrixeGuarabyra;Intro: E C#m E C#m      O homem chega e já desfaz a natureza                                           Tira a gente põe represa, diz que tudo vai mudar             O São Francisco lá pra cima da Bahia                                         Diz que dia menos dia vai subir bem devagar                                      E passo a passo vai cumprindo a profecia                                       Do beato que dizia que o sertão ia alagar                   O sertão vai virar mar   Dá no coração  O medo que algum dia        O mar também vire sertão            Vai virar mar  Dá no coração    O medo que algum dia            O mar também vire sertão           Adeus Remanso, Casa Nova, Sento-sé               Adeus Pilão Arcado vem o rio te engolir            Debaixo d'água lá se vai a vida inteira                 Por cima da cachoeira o Gaiola vai sumir             Vai ter barragem no salto do Sobradinho                   E o povo vai se embora com medo de se afogar       O sertão vai virar mar  Dá no coração    O medo que algum dia          O mar também vire sertão     Vai virar mar  Dá no coração     O medo que algum dia  O mar também vire sertão;PT-BR;https://api.vagalume.com.br/search.php?art= Sa, Rodrix e Guarabyra &mus=Sobradinho&apikey=dc668952146a4a25b6d06586e7b69708;exact
Ourodetolo;RaulSeixas;Eu devia estar contente  Porque eu tenho um emprego  Sou um dito cidadão respeitável  E ganho quatro mil cruzeiros por mês   Eu devia agradecer ao Senhor  Por ter tido sucesso na vida como artista  Eu devia estar feliz  Porque consegui comprar um Corcel 73  Eu devia estar alegre e satisfeito  Por morar em Ipanema  Depois de ter passado fome por dois anos  Aqui na Cidade Maravilhosa   Ah! Eu devia estar sorrindo e orgulhoso  Por ter finalmente vencido na vida  Mas eu acho isso uma grande piada  E um tanto quanto perigosa   Eu devia estar contente Por ter conseguido tudo o que eu quis  Mas confesso abestalhado  Que eu estou decepcionado  Porque foi tão fácil conseguir  E agora eu me pergunto: E daí?  Eu tenho uma porção de coisas grandes  Pra conquistar, e eu não posso ficar aí parado   Eu devia estar feliz pelo Senhor  Ter me concedido o domingo  Pra ir com a família ao Jardim Zoológico  Dar pipoca aos macacos   Ah! Mas que sujeito chato sou eu  Que não acha nada engraçado  Macaco praia, carro, jornal, tobogã  Eu acho tudo isso um saco   É você olhar no espelho  Se sentir um grandessíssimo idiota  Saber que é humano, ridículo, limitado  Que só usa dez por cento de sua  Cabeça animal  E você ainda acredita que é um doutor, padre ou policial  Que está contribuindo com sua parte  Para nosso belo quadro social   Eu que não me sento  No trono de um apartamento  Com a boca escancarada cheia de dentes  Esperando a morte chegar   Porque longe das cercas embandeiradas que separam quintais  No cume calmo do meu olho que vê  Assenta a sombra sonora de um disco voador   Eu que não me sento  No trono de um apartamento  Com a boca escancarada cheia de dentes  Esperando a morte chegar   Porque longe das cercas embandeiradas que separam quintais  No cume calmo do meu olho que vê Assenta a sombra sonora de um disco voador;PT-BR;https://api.vagalume.com.br/search.php?art= Raul Seixas &mus=Ouro-de-tolo&apikey=dc668952146a4a25b6d06586e7b69708;aprox
Casanocampo;ElisRegina;Eu quero uma casa no campo Onde eu possa compor muitos rocks rurais E tenha somente a certeza Dos amigos do peito e nada mais  Eu quero uma casa no campo Onde eu possa ficar no tamanho da paz E tenha somente a certeza Dos limites do corpo e nada mais  Eu quero carneiros e cabras pastando solenes No meu jardim Eu quero o silêncio das línguas cansadas Eu quero a esperança de óculos  E um filho de cuca legal Eu quero plantar e colher com a mão A pimenta e o sal Eu quero uma casa no campo  Do tamanho ideal, pau-a-pique e sapé Onde eu possa plantar meus amigos Meus discos e livros e nada mais! Onde eu possa plantar meus amigos  Meus discos meus livros e nada mais! Onde eu possa plantar meus amigos Meus discos e meus livros e nada mais!;PT-BR;https://api.vagalume.com.br/search.php?art= Elis Regina &mus=Casa-no-campo&apikey=dc668952146a4a25b6d06586e7b69708;aprox
Imagine;JohnLennonandThePlasticOnoBand;Imagine there's no heaven It's easy if you try No hell below us Above us only sky Imagine all the people living for today Imagine there's no countries It isn't hard to do Nothing to kill or die for And no religion too Imagine all the people living life in peace, you You may say I'm a dreamer But I'm not the only one I hope some day you'll join us And the world will be as one Imagine no possessions I wonder if you can No need for greed or hunger A brotherhood of man Imagine all the people sharing all the world, you You may say I'm a dreamer But I'm not the only one I hope some day you'll join us And the world will be as one;PT-BR;https://api.vagalume.com.br/search.php?art= John Lennon and The Plastic Ono Band &mus=Imagine&apikey=dc668952146a4a25b6d06586e7b69708;GoogleSearch OK
