Music;Artist;Text;Language;Url;Search Status;
Detalhes;RobertoCarlos;Não adianta nem tentar me esquecer Durante muito tempo em sua vida eu vou viver  Detalhes tão pequenos de nós dois São coisas muito grandes pra esquecer E a toda hora vão estar presentes Você vai ver  Se um outro cabeludo aparecer na sua rua E isso lhe trouxer saudades minhas, a culpa é sua O ronco barulhento do seu carro A velha calça desbotada ou coisa assim Imediatamente você vai lembrar de mim  Eu sei que um outro deve estar falando ao seu ouvido Palavras de amor como eu falei, mas, eu duvido Duvido que ele tenha tanto amor E até os erros do meu português ruim E nessa hora você vai lembrar de mim  À noite, envolvida no silêncio do seu quarto, Antes de dormir você procura o meu retrato Mas na moldura não sou eu quem lhe sorri Mas você vê o meu sorriso mesmo assim E tudo isso vai fazer você lembrar de mim  Se alguém tocar seu corpo como eu, não diga nada Não vá dizer meu nome sem querer à pessoa errada Pensando ter amor nesse momento, desesperada,  Você tenta até o fim E até nesse momento você vai lembrar de mim  Eu sei que esses detalhes vão sumir na longa estrada Do tempo que transforma todo amor em quase nada Mas quase também é mais um detalhe Um grande amor não vai morrer assim Por isso, de vez em quando você vai Vai lembrar de mim  Não adianta nem tentar me esquecer Durante muito e muito tempo em sua vida eu vou viver;PT-BR;https://api.vagalume.com.br/search.php?art= Roberto Carlos &mus=Detalhes&apikey=dc668952146a4a25b6d06586e7b69708;exact
JuventudeTransviada;LuizMelodia;Lava roupa todo dia, que agonia Na quebrada da soleira, que chovia Até sonhar de madrugada, uma moça sem mancada Uma mulher não deve vacilar  Eu entendo a juventude transviada E o auxílio luxuoso de um pandeiro Até sonhar de madrugada, uma moça sem mancada Uma mulher não deve vacilar  Cada cara representa uma mentira Nascimento, vida e morte, quem diria Até sonhar de madrugada, uma moça sem mancada Uma mulher não deve vacilar  Hoje pode transformar E o que diria a juventude Um dia você vai chorar Vejo claras fantasias;PT-BR;https://api.vagalume.com.br/search.php?art= Luiz Melodia &mus=Juventude-Transviada&apikey=dc668952146a4a25b6d06586e7b69708;aprox
Amigo;RobertoCarloseErasmoCarlos;Você meu amigo de fé, meu irmão camarada Amigo de tantos caminhos e tantas jornadas Cabeça de homem mas o coração de menino Aquele que está do meu lado em qualquer caminhada Me lembro de todas as lutas, meu bom companheiro Você tantas vezes provou que é um grande guerreiro O seu coração é uma casa de portas abertas Amigo você é o mais certo das horas incertas  Às vezes em certos momentos difíceis da vida Em que precisamos de alguém pra ajudar na saída A sua palavra de força, de fé e de carinho Me dá a certeza de que eu nunca estive sozinho  Você meu amigo de fé, meu irmão camarada Sorriso e abraço festivo da minha chegada Você que me diz as verdades com frases abertas Amigo você é o mais certo das horas incertas  Não preciso nem dizer  Tudo isso que eu lhe digo Mas é muito bom saber Que você é meu amigo  Não preciso nem dizer  Tudo isso que eu lhe digo Mas é muito bom saber  Que eu tenho um grande amigo  Não preciso nem dizer Tudo isso que eu lhe digo Mas é muito bom saber Que você é meu amigo  Não preciso nem dizer Tudo isso que eu lhe digo Mas é muito bom saber Que eu tenho um grande amigo;PT-BR;https://api.vagalume.com.br/search.php?art= Roberto Carlos e Erasmo Carlos &mus=Amigo&apikey=dc668952146a4a25b6d06586e7b69708;exact
OBêbadoeAEquilibrista;ElisRegina;Caía a tarde feito um viaduto E um bêbado trajando luto Me lembrou Carlitos...  A lua Tal qual a dona do bordel Pedia a cada estrela fria Um brilho de aluguel  E nuvens! Lá no mata-borrão do céu Chupavam manchas torturadas Que sufoco! Louco! O bêbado com chapéu-coco Fazia irreverências mil Pra noite do Brasil. Meu Brasil!...  Que sonha com a volta Do irmão do Henfil. Com tanta gente que partiu Num rabo de foguete Chora! A nossa Pátria Mãe gentil Choram Marias E Clarices No solo do Brasil...  Mas sei, que uma dor Assim pungente Não há de ser inutilmente A esperança...  Dança na corda bamba De sombrinha E em cada passo Dessa linha Pode se machucar...  Azar! A esperança equilibrista Sabe que o show De todo artista Tem que continuar...;PT-BR;https://api.vagalume.com.br/search.php?art= Elis Regina &mus=O-Bebado-e-A-Equilibrista&apikey=dc668952146a4a25b6d06586e7b69708;aprox
Nosilênciodamadrugada;LuizAyrão;Aproveitou o silêncio da madrugada     E sem dizer nada, catou     Os seus farrapos do roupeiro     Pegou todo o dinheiro e arribou     Falsamente aproveitou     O silêncio da madrugada     Como uma ladra     Realmente ela roubou     Todos os meus planos     Todos esses anos     Que em vão meu coração amou     Pegou meu violão seresteiro     Que eu custei o ano inteiro pra pagar a prestação mas também pra que que eu quero uma viola     Se ela foi embora e levou a inspiração     Aproveitou ...;PT-BR;https://api.vagalume.com.br/search.php?art= Luiz Ayrao &mus=No-silencio-da-madrugada&apikey=dc668952146a4a25b6d06586e7b69708;aprox
RetalhosdeCetim;BenitoDiPaula;Ensaiei meu samba o ano inteiro, Comprei surdo e tamborim.  Gastei tudo em fantasia, Era só o que eu queria. E ela jurou desfilar pra mim,  Minha escola estava tão bonita. Era tudo o que eu queria ver,  Em retalhos de cetim. Eu dormi o ano inteiro, E ela jurou desfilar pra mim.  Mas chegou o carnaval, E ela não desfilou, Eu chorei na avenida, eu chorei.  Não pensei que mentia a cabrocha, Que eu tanto amei...;PT-BR;https://api.vagalume.com.br/search.php?art= Benito Di Paula &mus=Retalhos-de-Cetim&apikey=dc668952146a4a25b6d06586e7b69708;aprox
IluAyê;ClaraNunes;Ilu Ayê, Ilu Ayê, Odara Negro cantava na nação nagô  Depois chorou lamentos de senzala Tão longe estava de sua Ilu Ayê Tempo passou e no terreirão da casa grande Negro diz tudo que pode dizer  É samba, é batuque, é reza É dança, é ladainha Negro joga capoeira E faz louvação à rainha  Hoje, negro é terra Negro é vida Na mutação do tempo Desfilando na avenida Negro é sensacional É toda festa do povo É dono do carnaval;PT-BR;https://api.vagalume.com.br/search.php?art= Clara Nunes &mus=Ilu-Aye&apikey=dc668952146a4a25b6d06586e7b69708;aprox
FoiumRioquepassouemMinhaVida;PaulinhodaViola;Se um dia  Meu coração for consultado                      Para saber se andou errado  Será difícil negar   Meu coração tem manias de amor  Amor não é fácil de achar  A marca dos meus desenganos  Ficou, ficou  Só um amor pode apagar  A marca dos meus desenganos  Ficou, ficou  Só um amor pode apagar   Porém, ai   porém  Há um caso diferente  Que marcou um breve tempo  Meu coração para sempre  Era dia de carnaval  Carregava uma tristeza  Não pensava em novo amor  Quando alguém que não me   Lembro anunciou  Portela, Portela  O samba trazendo alvorada  Meu coração conquistou  Ai, minha Portela  Quando vi você passar  Senti meu coração apressado               Todo meu corpo tomado  E alegria voltar  Não posso definir aquele azul       Não era do céu  Nem era do mar  Foi um rio     que passou em     Minha vida   E meu coração se deixou levar  Foi um rio     que passou em   Minha vida;PT-BR;https://api.vagalume.com.br/search.php?art= Paulinho da Viola &mus=Foi-um-Rio-que-passou-em-Minha-Vida&apikey=dc668952146a4a25b6d06586e7b69708;aprox
MoroOndeNãoMoraNinguém;Agepê;Moro onde não mora ninguém Onde não passa ninguém Onde não vive ninguém É lá onde moro Que eu me sinto bem Moro onde moro Moro onde não mora ninguém Onde não passa ninguém Onde não vive ninguém É lá onde moro Que eu me sinto bem Moro onde moro Moro onde não mora ninguém Onde não passa ninguém Onde não vive ninguém É lá onde moro Que eu me sinto bem Não tem bloco na rua Não tem carnaval Mas não saio de lá Meu passarinho me canta a mais linda Cantiga que há Coisas linda vem do lado de lá Coisas linda vem do lado de lá Moro onde moro (eu também moro) Moro onde não mora ninguém Onde não passa ninguém Onde não vive ninguém É lá onde moro Que eu me sinto bem Uma casinha branca No alto da serra Um coqueiro ao lado Um cachorro magro amarrado Um fogão de lenha Todo enfumaçado É lá onde moro Aonde não passa ninguém É lá que eu vivo sem guerra É lá que eu me sinto bem É lá onde moro Aonde não passa ninguém É lá que eu vivo sem guerra É lá que eu me sinto bem Moro onde moro Moro onde não mora ninguém Onde não passa ninguém Onde não vive ninguém É lá onde moro Que eu me sinto bem Moro onde moro (eu também moro) Moro onde não mora ninguém Onde não passa ninguém Onde não vive ninguém É lá onde moro Que eu me sinto bem Moro onde moro;PT-BR;https://api.vagalume.com.br/search.php?art= Agepe &mus=Moro-Onde-Nao-Mora-Ninguem&apikey=dc668952146a4a25b6d06586e7b69708;GoogleSearch OK
Outravez;RobertoCarlos;Você foi o maior dos meus casos  De todos os abraços  O que eu nunca esqueci  Você foi, dos amores que eu tive  O mais complicado e o mais simples pra mim   Você foi o melhor dos meus erros  A mais estranha história  Que alguém já escreveu  E é por essas e outras  Que a minha saudade faz lembrar  De tudo outra vez....   Você foi  A mentira sincera  Brincadeira mais séria que me aconteceu  Você foi  O caso mais antigo  O amor mais amigo que me apareceu   Das lembranças que eu trago na vida  Você é a saudade que eu gosto de ter  Só assim sinto você bem perto de mim  Outra vez           Esqueci de tentar te esquecer  Resolvi te querer por querer  Decidi te lembrar quantas vezes eu tenha vontade  Sem nada perder        Você foi  Toda a felicidade  Você foi a maldade que só me fez bem  Você foi  O melhor dos meus planos  E o maior dos enganos que eu pude fazer    Das lembranças que eu trago na vida  Você é a saudade que eu gosto de ter  Só assim sinto você bem perto de mim  Outra vez;PT-BR;https://api.vagalume.com.br/search.php?art= Roberto Carlos &mus=Outra-vez&apikey=dc668952146a4a25b6d06586e7b69708;aprox
Pai;FábioJR;Pai Pode ser que daqui a algum tempo Haja tempo pra gente ser mais Muito mais que dois grandes amigos Pai e filho talvez                                              Pai Pode ser que daí você sinta Qualquer coisa entre esses vinte ou trinta Longos anos em busca de paz....  Pai Pode crer Eu tô bem eu vou indo Tô tentando vivendo e pedindo Com loucura pra você renascer...  Pai Eu não faço questão de ser tudo Só não quero e não vou ficar mudo         Pra falar de amor pra você                Pai Senta aqui que o jantar tá na mesa Fala um pouco tua voz tá tão presa Nos ensina esse jogo da vida Onde a vida só paga pra ver  Pai Me perdoa essa insegurança É que eu não sou mais aquela criança Que um dia morrendo de medo Nos teus braços você fez segredo Nos teus passos você foi mais eu                Pai Eu cresci e não houve outro jeito Quero só recostar no teu peito Pra pedir pra você ir lá em casa  E brincar de vovô com meu filho No tapete da sala de estar  Pai Você foi meu herói meu bandido Hoje é mais muito mais que um amigo Nem você nem ninguém tá sozinho Você faz parte desse caminho Que hoje eu sigo em paz;PT-BR;https://api.vagalume.com.br/search.php?art= Fabio JR &mus=Pai&apikey=dc668952146a4a25b6d06586e7b69708;exact
Sampa;CaetanoVeloso;Alguma coisa acontece no meu coração Que só quando cruzo a Ipiranga e Av. São João É que quando eu cheguei por aqui eu nada entendi Da dura poesia concreta de tuas esquinas Da deselegância discreta de tuas meninas Ainda não havia para mim Rita Lee A tua mais completa tradução Alguma coisa acontece no meu coração Que só quando cruza a Ipiranga e avenida São João  Quando eu te encarei frente a frente e não vi o meu rosto Chamei de mau gosto o que vi, de mau gosto, mau gosto É que Narciso acha feio o que não é espelho E à mente apavora o que ainda não é mesmo velho Nada do que não era antes quando não somos mutantes E foste um difícil começo Afasto o que não conheço E quem vende outro sonho feliz de cidade Aprende depressa a chamar-te de realidade Porque és o avesso do avesso do avesso do avesso  Do povo oprimido nas filas, nas vilas, favelas Da força da grana que ergue e destrói coisas belas Da feia fumaça que sobe, apagando as estrelas Eu vejo surgir teus poetas de campos, espaços Tuas oficinas de florestas, teus deuses da chuva Pan-Américas de Áfricas utópicas, túmulo do samba Mas possível novo quilombo de Zumbi E os Novos Baianos passeiam na tua garoa E novos baianos te podem curtir numa boa;PT-BR;https://api.vagalume.com.br/search.php?art= Caetano Veloso &mus=Sampa&apikey=dc668952146a4a25b6d06586e7b69708;exact
SangueLatino;SecoseMolhados;Jurei mentiras E sigo sozinho Assumo os pecados Os ventos do norte Não movem moinhos E o que me resta É só um gemido  Minha vida, meus mortos Meus caminhos tortos Meu sangue latino Minh'alma cativa  Rompi tratados Traí os ritos Quebrei a lança Lancei no espaço Um grito, um desabafo E o que me importa É não estar vencido;PT-BR;https://api.vagalume.com.br/search.php?art= Secos e Molhados &mus=Sangue-Latino&apikey=dc668952146a4a25b6d06586e7b69708;aprox
Fiomaravilha;MariaAlcina;E novamente ele chegou com inspiração Com muito amor, com emoção Com explosão e gol, gol Sacudindo a torcida aos 33 minutos Do segundo tempo Depois de fazer uma jogada celestial Em gol, gol Tabelou, driblou dois zagueiros Deu um toque driblou o goleiro Só não entrou com bola e tudo Porque teve humildade em gol, gol Foi um gol de classe Onde ele mostrou sua malícia e sua raça Foi um gol de anjo  Um verdadeiro gol de placa (2x) Que a galera agradecida assim cantava Fio Maravilha, nós gostamos de você Fio Maravilha faz mais um pra gente ver (2x);PT-BR;https://api.vagalume.com.br/search.php?art= Maria Alcina &mus=Fio-maravilha&apikey=dc668952146a4a25b6d06586e7b69708;aprox
Paralelas;Vanusa;Dentro do carro,  sobre o trevo, a cem por hora,  o meu amor Só tens agora os carinhos do motor E no escritório onde eu trabalho  e fico rico quanto mais eu multiplico,  dimimui o meu amor... Em cada luz de mercúrio, vejo a luz do teu olhar Passas praças, viadutos,  nem te lembras de voltar, de voltar, de voltar... No corcovado quem abre os braços, sou eu Copacabana esta semana, o mar, sou eu  e as borboletas do que fui pousam demais  por entre as flores do asfalto em que tu vais...  E as paralelas dos pneus n'água das ruas São duas estradas nuas   em que foges do que é teu No apartamento, oitavo andar, abro a vidraça e grito quando o carro passa: - Teu infinito sou eu, sou eu, sou eu, sou eu No Corcovado, quem abre os braços, sou eu,  Copocabana esta semana, o mar, sou eu   e as borboletas do que fui pousam demais  por entre as flores do asfalto em que tu vais.;PT-BR;https://api.vagalume.com.br/search.php?art= Vanusa &mus=Paralelas&apikey=dc668952146a4a25b6d06586e7b69708;exact
Sonhos;Peninha;Tudo era apenas uma brincadeira E foi crescendo, crescendo, me absorvendo  E de repente eu me vi assim completamente seu Vi a minha força amarrada no seu passo Vi que sem você não tem caminho, eu não me acho Vi um grande amor gritar dentro de mim como eu sonhei um dia Quando o meu mundo era mais mundo E todo mundo admitia Uma mudança muito estranha Mais pureza, mais carinho, mais calma, mais alegria       no meu jeito de me dar Quando a canção se fez mais forte e mais sentida Quando a poesia fez folia em minha vida Você veio me contar dessa paixão inesperada  Por outra pessoa Mas não tem revolta não Eu só quero que você se encontre           Ter Saudade até que é bom  É melhor que caminhar vazio A esperança é um Dom Que eu tenho em mim Eu tenho sim Não tem desespero não  Você me ensinou milhões de coisas Tenho um sonho em minhas mãos Amanhã será um novo dia Certamente eu vou ser mais feliz;PT-BR;https://api.vagalume.com.br/search.php?art= Peninha &mus=Sonhos&apikey=dc668952146a4a25b6d06586e7b69708;exact
Meumundoenadamais;GuilhermeArantes;Quando eu fui ferido Vi tudo mudar Das verdades Que eu sabia  Só sobraram restos E eu não esqueci Toda aquela paz Que eu tinha  Eu que tinha tudo Hoje estou mudo Estou mudado À meia-noite, à meia luz Pensando! Daria tudo por um modo de esquecer  Eu queria tanto Estar no escuro do meu quarto À meia-noite, à meia luz Sonhando! Daria tudo por meu mundo e nada mais  Não estou bem certo Se ainda vou sorrir Sem um travo de amargura  Como ser mais livre Como ser capaz De enxergar um novo dia  Eu que tinha tudo Hoje estou mudo Estou mudado À meia-noite, à meia luz Pensando! Daria tudo por um modo de esquecer  Eu queria tanto Estar no escuro do meu quarto À meia-noite, à meia luz Sonhando! Daria tudo por meu mundo e nada mais  Eu queria tanto Estar no escuro do meu quarto À meia-noite, à meia luz Sonhando! Daria tudo por meu mundo e nada mais;PT-BR;https://api.vagalume.com.br/search.php?art= Guilherme Arantes &mus=Meu-mundo-e-nada-mais&apikey=dc668952146a4a25b6d06586e7b69708;aprox
ExplodeCoração;MariaBethânia;Chega de tentar dissimular E disfarçar e esconder O que não da mais pra ocultar E eu não posso mais calar Já que o brilho desse olhar foi traidor E entregou o que você tentou conter O que você não quis desabafar e me cortou  Chega de temer,chorar,sofrer Sorrir,se dar,e se perder,e se achar Que tudo aquilo que é viver, Eu quero  mais é me abrir E que essa vida entre assim Como se fosse o sol Desvirginando a madrugada Quero sentir a dor dessa manhã  Nascendo,rompendo,rasgando, E tomando meu corpo e então eu Chorando,sofrendo,gostando,adorando,gritando Feito louco, alucinado e criança Sentindo o meu amor se derramando Não da mais pra segurar Explode coração;PT-BR;https://api.vagalume.com.br/search.php?art= Maria Bethania &mus=Explode-Coracao&apikey=dc668952146a4a25b6d06586e7b69708;aprox
Nãoexistepecadoaosuldoequador;NeyMatogrosso;Não existe pecado do lado de baixo Do Equador Vamos fazer um pecado, Rasgado, suado a todo vapor  Me deixa ser teu escracho Capacho, teu cacho, diacho Um riacho de amor Quando é lição de esculacho  Olha aí, sai de baixo Que eu sou professor Deixa a tristeza pra lá Vem comer, me jantar  Sarapatel, caruru, tucupi, tacacá Vê se me usa, me abusa, lambuza Que a tua cafuza Não pode esperar  Deixa a tristeza pra lá Vem comer, me jantar Sarapatel, caruru, tucupi, tacacá Vê se me esgota, me bota na mesa Que a tua holandesa Não pode esperar;PT-BR;https://api.vagalume.com.br/search.php?art= Ney Matogrosso &mus=Nao-existe-pecado-ao-sul-do-equador&apikey=dc668952146a4a25b6d06586e7b69708;aprox
Superhomem(acanção);GilbertoGil;Um dia Vivi a ilusão de que ser homem bastaria Que o mundo masculino tudo me daria Do que eu quisesse ter Que nada Minha porção mulher, que até então se resguardara É a porção melhor que trago em mim agora É que me faz viver Quem dera Pudesse todo homem compreender, oh, mãe, quem dera Ser o verão o apogeu da primavera E só por ela ser Quem sabe O Superhomem venha nos restituir a glória Mudando como um deus o curso da história Por causa da mulher;PT-BR;https://api.vagalume.com.br/search.php?art= Gilberto Gil &mus=Superhomem-(a-cancao)&apikey=dc668952146a4a25b6d06586e7b69708;GoogleSearch OK
Madalena;ElisRegina;Oh Madalena, o meu peito percebeu que o mar é uma gota comparado ao pranto meu  Fique certa, quando o nosso amor desperta logo o sol se desespera e se esconde lá na serra  Madalena, o que é meu não se divide Nem tampouco se admite Quem do nosso amor duvide  Até a lua se arrisca num palpite Que o nosso amor existe Forte ou fraco alegre ou triste;PT-BR;https://api.vagalume.com.br/search.php?art= Elis Regina &mus=Madalena&apikey=dc668952146a4a25b6d06586e7b69708;exact
Vocêabusou;AntonioCarloseJocafi;Você abusou Tirou partido de mim Abusou Tirou partido de mim Abusou Tirou partido de mim Abusou Mas não faz mal É tão normal ter desamor É tão cafona sofrer dor Que já não sei se é meninice ou cafonice O meu amor Se o quadradismo dos meus versos Vai de encontro aos intelectos Que não usam o coração Como expressão  Voce Abusou ....  Que me perdoe Se eu insisto nesse tema Mas não sei fazer poema ou canção Que fale de outra coisa Que não seja o amor Se o quadradismo dos meus versos...  Essa música é a 1ª faixa do lado A do LP Mudei de Idéia de 1971;PT-BR;https://api.vagalume.com.br/search.php?art= Antonio Carlos e Jocafi &mus=Voce-abusou&apikey=dc668952146a4a25b6d06586e7b69708;aprox
AzulDaCorDoMar;TimMaia;Ah! Se o mundo inteiro me pudesse ouvir Tenho muito pra contar Dizer que aprendi      E na vida a gente tem que entender Que um nasce pra sofrer Enquanto o outro ri  Mas quem sofre sempre tem que procurar Pelo menos vir a achar Razão para viver  Ver na vida  algum motivo pra sonhar Ter um sonho todo azul Azul da cor do mar;PT-BR;https://api.vagalume.com.br/search.php?art= Tim Maia &mus=Azul-Da-Cor-Do-Mar&apikey=dc668952146a4a25b6d06586e7b69708;aprox
DancingDays;AsFrenéticas;Abra suas asas, solte suas feras, caia na gandaia, entre nessa festa E leve com vocêee seu sonho mais loouuco Eu quero ver seu corpo,  lindo, leve e solto A gente as vezes, sente, sofre, dança,  sem querer dançar Na nossa festa vale tudo  vale ser alguém como eu,  como você  Abra suas asas, solte suas feras, caia na gandaia, entre nessa festa E leve com vocêee seu sonho mais loouuco Eu quero ver seu corpo,  lindo, leve e solto A gente as vezes, sente, sofre, dança,  sem querer dançar Na nossa festa vale tudo  vale ser alguém como eu,  como você  A gente as vezes, sente, sofre, dança,  sem querer dançar Na nossa festa vale tudo  vale ser alguém como eu,  como você  Dance bem, dance mal, dance sem parar dance bem, dance até, sem saber dançar  Dance bem, dance mal, dance sem parar dance bem, dance até, sem saber dançar  Na nossa festa vale tudo  vale ser alguém como eu,  como você   Na nossa festa vale tudo  vale ser alguém como eu,  como você   Na nossa festa vale tudo  vale ser alguém como eu,  como você   Dance bem, dance mal, dance sem parar dance bem, dance até, sem saber dançar  Dance bem, dance mal, dance sem parar dance bem, dance até, sem saber dançar  Na nossa festa vale tudo  vale ser alguém como eu,  como você (4x);PT-BR;https://api.vagalume.com.br/search.php?art= As Freneticas &mus=Dancing-Days&apikey=dc668952146a4a25b6d06586e7b69708;aprox
CidadeDoSalvador;EuSóQueroUmXodó;Que falta eu sinto de um bem Que falta me faz um xodó Mas como eu não tenho ninguém Eu levo a vida assim tão só Eu só quero um amor Que acabe o meu sofrer Um xodó pra mim Do meu jeito assim Que alegre o meu viver Que falta eu sinto de um bem Que falta me faz um xodó Mas como eu não tenho ninguém Eu levo a vida assim tão só Eu só quero um amor Que acabe o meu sofrer Um xodó pra mim Do meu jeito assim Que alegre o meu viver;PT-BR;https://api.vagalume.com.br/search.php?art= Eu So Quero Um Xodo &mus=Cidade-Do-Salvador&apikey=dc668952146a4a25b6d06586e7b69708;GoogleSearch OK
MinhaMadrinha,MangueiraQuerida;JairRodrigues;Tengo-Tengo Santo Antônio, Chalé Minha gente É muito samba no pé! (Vamos nos!) Tengo-Tengo Santo Antônio, Chalé Minha gente É muito samba no pé! Em noite linda Em noite bela Iremos na avenida Desfilar em passarela (Nossa Senhora) Em noite linda Em noite bela Iremos na avenida Desfilar em passarela O batizado será lembrado Pelo Salgueiro de agora Alô Laurindo, alô Viola Alô Mangueira de Cartola Tengo-Tengo Santo Antônio, Chalé (Ô minha gente) Minha gente É muito samba no pé! Tengo-Tengo Santo Antônio, Chalé Minha gente É muito samba no pé! Ô-ô-ô, ó meu Senhor Foi Mangueira Estação Primeira Quem nos batizou Ô-ô-ô, ó meu Senhor Foi Mangueira Estação primeira Quem nos batizou O batizado será lembrado Pelo Salgueiro de agora Alô Laurindo, alô Viola Alô Mangueira de Cartola Tengo-Tengo Santo Antônio, Chalé (Ô minha gente) Minha gente É muito samba no pé! Tengo-Tengo Santo Antônio, Chalé Minha gente É muito samba no pé!;PT-BR;https://api.vagalume.com.br/search.php?art= Jair Rodrigues &mus=Minha-Madrinha-Mangueira-Querida&apikey=dc668952146a4a25b6d06586e7b69708;GoogleSearch OK
Excuseme;Junior;You, a float in the lost world of dreams A mystical maker of schemes Emotion beyond my means Me, no more than a grain of sand And lost on the beach of your land Unable to understand When you're near Reality loses its hold And loneliness' tears wet my soul But what was on inside your mind And what I know That fantasy drives us mad It really can't bring so bad To let it take me one more time Love, the chances seem so very few Excuse me for the strange things I do I'm drowning in an ocean of you When you're near Reality loses its hold And loneliness' tears wet my soul But what was on inside your mind And what I know That fantasy drives us mad It really can't bring so bad To let it take me one more time...;PT-BR;https://api.vagalume.com.br/search.php?art= Junior &mus=Excuse-me&apikey=dc668952146a4a25b6d06586e7b69708;GoogleSearch OK
